[
  {
    "route_id": "route:cp-studio-pages",
    "surface": "cp",
    "path": "/cp/studio/pages",
    "page_id": "cp-studio-pages",
    "guard_pack_id": "guard:default",
    "flag_gate_id": "flag:default",
    "entitlement_gate_id": "entitlement:default",
    "priority": 10,
    "canonical": true,
    "aliases": [],
    "deprecation_date": "",
    "redirect_to": ""
  },
  {
    "route_id": "route:cp-studio-routes",
    "surface": "cp",
    "path": "/cp/studio/routes",
    "page_id": "cp-studio-routes",
    "guard_pack_id": "guard:default",
    "flag_gate_id": "flag:default",
    "entitlement_gate_id": "entitlement:default",
    "priority": 10,
    "canonical": true,
    "aliases": [],
    "deprecation_date": "",
    "redirect_to": ""
  },
  {
    "route_id": "route:cp-studio-nav",
    "surface": "cp",
    "path": "/cp/studio/nav",
    "page_id": "cp-studio-nav",
    "guard_pack_id": "guard:default",
    "flag_gate_id": "flag:default",
    "entitlement_gate_id": "entitlement:default",
    "priority": 10,
    "canonical": true,
    "aliases": [],
    "deprecation_date": "",
    "redirect_to": ""
  },
  {
    "route_id": "route:cp-studio-releases",
    "surface": "cp",
    "path": "/cp/studio/releases",
    "page_id": "cp-studio-releases",
    "guard_pack_id": "guard:default",
    "flag_gate_id": "flag:default",
    "entitlement_gate_id": "entitlement:default",
    "priority": 10,
    "canonical": true,
    "aliases": [],
    "deprecation_date": "",
    "redirect_to": ""
  },
  {
    "route_id": "route:cp-studio-health",
    "surface": "cp",
    "path": "/cp/studio/health",
    "page_id": "cp-studio-health",
    "guard_pack_id": "guard:default",
    "flag_gate_id": "flag:default",
    "entitlement_gate_id": "entitlement:default",
    "priority": 10,
    "canonical": true,
    "aliases": [],
    "deprecation_date": "",
    "redirect_to": ""
  },
  {
    "route_id": "route:jobs-list",
    "surface": "client",
    "path": "/jobs",
    "page_id": "client-jobs-list",
    "guard_pack_id": "guard:default",
    "flag_gate_id": "flag:default",
    "entitlement_gate_id": "entitlement:default",
    "priority": 10,
    "canonical": true,
    "aliases": [],
    "deprecation_date": "",
    "redirect_to": ""
  },
  {
    "route_id": "route:jobs-detail",
    "surface": "client",
    "path": "/jobs/:id",
    "page_id": "client-jobs-detail",
    "guard_pack_id": "guard:default",
    "flag_gate_id": "flag:default",
    "entitlement_gate_id": "entitlement:default",
    "priority": 10,
    "canonical": true,
    "aliases": [],
    "deprecation_date": "",
    "redirect_to": ""
  },
  {
    "route_id": "route:docs-list",
    "surface": "client",
    "path": "/documents",
    "page_id": "client-docs-list",
    "guard_pack_id": "guard:default",
    "flag_gate_id": "flag:default",
    "entitlement_gate_id": "entitlement:default",
    "priority": 10,
    "canonical": true,
    "aliases": [],
    "deprecation_date": "",
    "redirect_to": ""
  },
  {
    "route_id": "route:docs-detail",
    "surface": "client",
    "path": "/documents/:id",
    "page_id": "client-docs-detail",
    "guard_pack_id": "guard:default",
    "flag_gate_id": "flag:default",
    "entitlement_gate_id": "entitlement:default",
    "priority": 10,
    "canonical": true,
    "aliases": [],
    "deprecation_date": "",
    "redirect_to": ""
  },
  {
    "route_id": "route:billing-invoices",
    "surface": "client",
    "path": "/billing/invoices",
    "page_id": "client-billing-invoices",
    "guard_pack_id": "guard:default",
    "flag_gate_id": "flag:default",
    "entitlement_gate_id": "entitlement:default",
    "priority": 10,
    "canonical": true,
    "aliases": [],
    "deprecation_date": "",
    "redirect_to": ""
  },
  {
    "route_id": "route:billing-invoice-detail",
    "surface": "client",
    "path": "/billing/invoices/:id",
    "page_id": "client-billing-invoice-detail",
    "guard_pack_id": "guard:default",
    "flag_gate_id": "flag:default",
    "entitlement_gate_id": "entitlement:default",
    "priority": 10,
    "canonical": true,
    "aliases": [],
    "deprecation_date": "",
    "redirect_to": ""
  },
  {
    "route_id": "route:cp-studio-modules",
    "surface": "cp",
    "path": "/cp/studio/modules",
    "page_id": "cp-studio-modules",
    "guard_pack_id": "guard:default",
    "flag_gate_id": "flag:default",
    "entitlement_gate_id": "entitlement:default",
    "priority": 10,
    "canonical": true,
    "aliases": [],
    "deprecation_date": "",
    "redirect_to": ""
  },
  {
    "route_id": "route:cp-studio-module-editor",
    "surface": "cp",
    "path": "/cp/studio/modules/:id",
    "page_id": "cp-studio-module-editor",
    "guard_pack_id": "guard:default",
    "flag_gate_id": "flag:default",
    "entitlement_gate_id": "entitlement:default",
    "priority": 10,
    "canonical": true,
    "aliases": [],
    "deprecation_date": "",
    "redirect_to": ""
  },
  {
    "route_id": "route:cp-studio-marketplace",
    "surface": "cp",
    "path": "/cp/studio/marketplace",
    "page_id": "cp-studio-marketplace",
    "guard_pack_id": "guard:default",
    "flag_gate_id": "flag:default",
    "entitlement_gate_id": "entitlement:default",
    "priority": 10,
    "canonical": true,
    "aliases": [],
    "deprecation_date": "",
    "redirect_to": ""
  },
  {
    "route_id": "route:cp-studio-tenant-marketplace",
    "surface": "cp",
    "path": "/cp/studio/tenants/:id/marketplace",
    "page_id": "cp-studio-tenant-marketplace",
    "guard_pack_id": "guard:default",
    "flag_gate_id": "flag:default",
    "entitlement_gate_id": "entitlement:default",
    "priority": 10,
    "canonical": true,
    "aliases": [],
    "deprecation_date": "",
    "redirect_to": ""
  },
  {
    "route_id": "route:jobs-dashboard",
    "surface": "client",
    "path": "/jobs/dashboard",
    "page_id": "client-jobs-dashboard",
    "guard_pack_id": "guard:default",
    "flag_gate_id": "flag:default",
    "entitlement_gate_id": "entitlement:default",
    "priority": 10,
    "canonical": true,
    "aliases": [],
    "deprecation_date": "",
    "redirect_to": ""
  },
  {
    "route_id": "route:docs-dashboard",
    "surface": "client",
    "path": "/documents/dashboard",
    "page_id": "client-docs-dashboard",
    "guard_pack_id": "guard:default",
    "flag_gate_id": "flag:default",
    "entitlement_gate_id": "entitlement:default",
    "priority": 10,
    "canonical": true,
    "aliases": [],
    "deprecation_date": "",
    "redirect_to": ""
  },
  {
    "route_id": "route:billing-dashboard",
    "surface": "client",
    "path": "/billing/dashboard",
    "page_id": "client-billing-dashboard",
    "guard_pack_id": "guard:default",
    "flag_gate_id": "flag:default",
    "entitlement_gate_id": "entitlement:default",
    "priority": 10,
    "canonical": true,
    "aliases": [],
    "deprecation_date": "",
    "redirect_to": ""
  },
  {
    "route_id": "route:cp-studio-design",
    "surface": "cp",
    "path": "/cp/studio/design",
    "page_id": "cp-studio-design",
    "guard_pack_id": "guard:default",
    "flag_gate_id": "flag:default",
    "entitlement_gate_id": "entitlement:default",
    "priority": 10,
    "canonical": true,
    "aliases": [],
    "deprecation_date": "",
    "redirect_to": ""
  },
  {
    "route_id": "route:bizdocs-documents",
    "surface": "client",
    "path": "/app/documents",
    "page_id": "page:documents",
    "guard_pack_id": "guard:default",
    "flag_gate_id": "flag:default",
    "entitlement_gate_id": "entitlement:default",
    "priority": 10,
    "canonical": true,
    "aliases": [],
    "deprecation_date": "",
    "redirect_to": ""
  },
  {
    "route_id": "route:bizdocs-pdf-exports",
    "surface": "client",
    "path": "/app/pdf-exports",
    "page_id": "page:pdf_exports",
    "guard_pack_id": "guard:default",
    "flag_gate_id": "flag:default",
    "entitlement_gate_id": "entitlement:default",
    "priority": 10,
    "canonical": true,
    "aliases": [],
    "deprecation_date": "",
    "redirect_to": ""
  },
  {
    "route_id": "route:bizdocs-ocr-inbox",
    "surface": "client",
    "path": "/app/ocr-inbox",
    "page_id": "page:ocr_inbox",
    "guard_pack_id": "guard:default",
    "flag_gate_id": "flag:default",
    "entitlement_gate_id": "entitlement:default",
    "priority": 10,
    "canonical": true,
    "aliases": [],
    "deprecation_date": "",
    "redirect_to": ""
  },
  {
    "route_id": "route:bizdocs-accounting-sync",
    "surface": "client",
    "path": "/app/accounting-sync",
    "page_id": "page:accounting_sync",
    "guard_pack_id": "guard:default",
    "flag_gate_id": "flag:default",
    "entitlement_gate_id": "entitlement:default",
    "priority": 10,
    "canonical": true,
    "aliases": [],
    "deprecation_date": "",
    "redirect_to": ""
  }
]
